{
  "role": "checker",
  "verdict": "PASS",
  "criteria": {
    "decision_grounded_in_actual_on_disk_evidence_not_the_stale_queue_description": true,
    "no_zip_content_reconstructed_from_memory": true,
    "adr_open_question_4_answered_with_recorded_rationale": true,
    "queue_item_closed_per_repo_own_convention_not_silently_deleted": true,
    "no_edits_made_to_the_four_c_files_pending_dotnet_build_under_trail_6ea25a3f": true,
    "no_fabricated_dotnet_build_or_install_claims": true
  },
  "notes": "All three file changes (ADR addendum, RECONCILIATION addendum, queue item move to done/) are documentation/governance edits grounded in files actually read this trail (create-skill's SKILL.md metadata, pmcro-marketplace-directory's plugin.json and eval fixtures, the ADR's own Open Questions section). No C# was touched; trail 6ea25a3f remains separately open and unaffected. Verdict PASS is warranted here (unlike 6ea25a3f) because this trail's claims are all independently checkable by reading the files in this repo, not contingent on an unreachable compiler.",
  "ts": "2026-09-06T05:07:00Z"
}
