{
  "role": "checker",
  "verdict": "PASS",
  "criteria": {
    "all_35_files_updated": true,
    "validator_reports_zero_failures": true,
    "footer_text_matches_canonical_wording_exactly": true,
    "no_other_content_altered": true
  },
  "notes": "Re-verified independently: ran validate_skill_md.py against all 35 reasoning skill directories, 0 failures. This closes a real, repo-wide compliance gap (every reasoning strategy skill was out of spec with L-OUTPUT-CONTRACT before this fix).",
  "ts": "2026-09-06T06:39:00Z"
}
