{
  "role": "checker",
  "verdict": "PASS",
  "criteria": {
    "step_2_bullets_consistently_conditional": true,
    "step_3_truncation_fixed": true,
    "validator_still_passes_on_edited_file": true,
    "no_unrelated_scope_creep": true
  },
  "notes": "Directly resolves live user-reported feedback from this session. Confirmed via validate_skill_md.py that the edit does not break the file's own compliance and that the validator was never actually enforcing folder existence (the report was about the *instructions* being overly rigid, not the validator - correctly diagnosed and fixed at the source). Incidental finding (reasoning/ skills missing Output Law footers) correctly left out of this trail's scope rather than expanded into.",
  "ts": "2026-09-06T06:37:10Z"
}
